{"schema_version":"1.1.0","channel":"chatgpt-web-github-issue-pr-writer","repository":"vibemathing/problem-opg-46613-cubic-p3-partition","repository_identity":{"binding_state":"verified","database_id":1358762601,"node_id":"R_kgDOUP0SaQ","default_branch":"main"},"problem_id":"problem:opg-46613-cubic-p3-partition","problem_contract_sha256":"f22ec1937d8b771614cb85435b6d4e0712afb9a3939780e04b74e4649617c26a","harness_snapshot_sha256":"c361ab971cb9dc51270888c605adb9dc84d98e8f33316d9fc23d7064a8d24718","base_revision":"db657865c432d10c6f57b6355f0ab17c42f57a09","importer_policy_sha256":"a7650a8ba5be3fef370914b24a49b1118f57dc12f41980f21b11ef2b0a8267c1","attempt_id":"attempt:web-20260906-opg46613-a01","route_id":"route:two-factor-divisible-cycles-v1","graph_id":"graph:opg46613-initial-v1","obligation_id":"obligation:opg46613-root","generator":{"principal":"chatgpt-web-github","model_label":"GPT-6 Astra Pro","model_fingerprint_status":"unverified"},"transport":{"branch":"web/attempt-opg46613-triangle-simulator-audit-r01","issue_number":3,"issue_url":"https://github.com/vibemathing/problem-opg-46613-cubic-p3-partition/issues/3","pull_request_number":null,"pull_request_url":null},"objective":"Audit the exact 45-vertex triangle simulator and its two-way triangle-free root reduction: new finite checker, complete ordered-state certificates and mutation tests, full host/gluing proof, and a scoped admission request without self-signing.","candidate_artifacts":[{"candidate_id":"candidate:opg46613-triangle-simulator-audit-r01-input-json","kind":"computation","locator":"research/artifacts/candidates/opg46613-triangle-simulator-audit-r01/input.json","sha256":"60ffcd2ba66072adabdf61ab41ee20866c86d2c31235615c974de2083c54be08"},{"candidate_id":"candidate:opg46613-triangle-simulator-audit-r01-checker-py","kind":"computation","locator":"research/artifacts/candidates/opg46613-triangle-simulator-audit-r01/checker.py","sha256":"f80ac65511f58aa9e97a769eabff03f81f790f6a44178507fc5629782a09cc19"},{"candidate_id":"candidate:opg46613-triangle-simulator-audit-r01-run-bounded-py","kind":"computation","locator":"research/artifacts/candidates/opg46613-triangle-simulator-audit-r01/run_bounded.py","sha256":"2f8bdbca5f6c08277b9829f0aec5280590b876c87440a56c702f44a6761c83ac"},{"candidate_id":"candidate:opg46613-triangle-simulator-audit-r01-stdout-json","kind":"computation","locator":"research/artifacts/candidates/opg46613-triangle-simulator-audit-r01/stdout.json","sha256":"962cee38b33231d6847bd33f3357ab84d28290cb4d17ef5e3676ac74afde8a2f"},{"candidate_id":"candidate:opg46613-triangle-simulator-audit-r01-stderr-txt","kind":"computation","locator":"research/artifacts/candidates/opg46613-triangle-simulator-audit-r01/stderr.txt","sha256":"e3b0c44298fc1c149afbf4c8996fb92427ae41e4649b934ca495991b7852b855"},{"candidate_id":"candidate:opg46613-triangle-simulator-audit-r01-execution-json","kind":"computation","locator":"research/artifacts/candidates/opg46613-triangle-simulator-audit-r01/execution.json","sha256":"3b6d7a7c28b5c5f726caa33e0959285130b8d316d5c577140f9909f2c6bac2d0"},{"candidate_id":"candidate:opg46613-triangle-simulator-audit-r01-report-md","kind":"proof","locator":"research/artifacts/candidates/opg46613-triangle-simulator-audit-r01/report.md","sha256":"a7247c8ad62756a160e361b1f4d91a62ad377a58a960c2b8727c6e242da549e2"},{"candidate_id":"candidate:opg46613-triangle-simulator-audit-r01-source-faithfulness-md","kind":"proof","locator":"research/artifacts/candidates/opg46613-triangle-simulator-audit-r01/source-faithfulness.md","sha256":"ba196269f8e9eb816ac273163e2c0c44d0dbb00ecc510964c5606cdad472c162"},{"candidate_id":"candidate:opg46613-triangle-simulator-audit-r01-admission-request-json","kind":"computation","locator":"research/artifacts/candidates/opg46613-triangle-simulator-audit-r01/admission-request.json","sha256":"9be896c247e332abab6452a7441685bd7c5d1bb6c61aa6fe2b910d8a9d1a5ca1"},{"candidate_id":"candidate:opg46613-triangle-simulator-audit-r01-manifest-json","kind":"computation","locator":"research/artifacts/candidates/opg46613-triangle-simulator-audit-r01/manifest.json","sha256":"6ad14d5ba627d88186816d1d774fd6abdc3964820554ec927f0ede4694853d93"}],"atomic_claims":[{"claim_id":"claim:opg46613-triangle-simulator-audit-r01-h","text":"The exact 18-vertex H is simple cubic bipartite, has girth six and is 3-vertex-connected; all three supplied Hamilton cycles pass.","status":"candidate"},{"claim_id":"claim:opg46613-triangle-simulator-audit-r01-interfaces","text":"All 27 ordered states for each of triangle,J,T were decided. J has every balanced state except AAA; T has precisely the triangle states, excluding BBB. Every positive entry has a complete checked partition and every negative entry has a residue/isolation or exhaustive certificate.","status":"candidate"},{"claim_id":"claim:opg46613-triangle-simulator-audit-r01-bbb","text":"All eight side assignments for outer B centers induce only 0/A states in the J cells and fail by residue or the isolated-w AAA obstruction; the direct exact-cover search agrees.","status":"candidate"},{"claim_id":"claim:opg46613-triangle-simulator-audit-r01-reduction","text":"Preserving selected external incidences and roles gives two-way P3-factor replacement. One-at-a-time contraction and capped three-sums preserve the root graph domain. Replacing t disjoint triangles gives order n+42t<=15n and no new triangles.","status":"candidate"},{"claim_id":"claim:opg46613-triangle-simulator-audit-r01-replay","text":"A fresh bounded Python 3.13.5 execution exited zero, verified 96 actual state/port gluings and 6/48/90-vertex replacement controls, and rejected 15 semantic mutations. This is same-generation-domain execution, not an admitted verifier receipt.","status":"candidate"},{"claim_id":"claim:opg46613-triangle-simulator-audit-r01-scope","text":"The result is equivalence to the triangle-free restriction, not root truth, not a claim about smallest counterexamples, and not a general girth-six reduction. Registered verification/admission remains requested and pending.","status":"candidate"}],"assumptions":["Finite simple cubic 3-vertex-connected root graphs, positive order divisible by three.","Noninduced P3 semantics; each distinct cell port has exactly one external edge.","Only finite-graph-basic and finite-combinatorics axioms."],"risks":["New checker has no shared imported/copied old core but remains in the same generation trust domain.","Finite state and graph replay does not replace the general gluing/host-preservation proof.","Registered verifier identities have fixture policies; no accessible mathematical verification workflow or attestation for this package was found. Only the candidate transport workflow is available.","No Lean elaboration or axiom audit; historical missing raw outputs and pending C08 Lean are unchanged.","Both canonical obligations remain open; the legacy strengthening DAG dependency is not assumed or edited."],"open_obligations":["obligation:opg46613-root","obligation:opg46613-divisible-two-factor"],"failed_route_proposal":null,"source_refs":[{"repository":"vibemathing/problem-opg-46613-cubic-p3-partition","path":"problem-library/records/canonical-problems.jsonl","revision":"db657865c432d10c6f57b6355f0ab17c42f57a09","relation":"exact"},{"repository":"vibemathing/problem-opg-46613-cubic-p3-partition","path":"research/records/obligation-graphs.jsonl","revision":"db657865c432d10c6f57b6355f0ab17c42f57a09","relation":"exact"},{"repository":"vibemathing/problem-opg-46613-cubic-p3-partition","path":"research/records/failed-routes.jsonl","revision":"db657865c432d10c6f57b6355f0ab17c42f57a09","relation":"exact"},{"repository":"vibemathing/problem-opg-46613-cubic-p3-partition","path":"research/artifacts/candidates/opg46613-root-r07/triangle-free-root-reduction.md","revision":"db657865c432d10c6f57b6355f0ab17c42f57a09","relation":"exact"},{"repository":"vibemathing/problem-opg-46613-cubic-p3-partition","path":"research/artifacts/candidates/opg46613-root-r07/root-equivalences.md","revision":"db657865c432d10c6f57b6355f0ab17c42f57a09","relation":"prior_art"},{"repository":"vibemathing/problem-opg-46613-cubic-p3-partition","path":"research/artifacts/candidates/opg46613-r07-object-audit-r01/report.md","revision":"db657865c432d10c6f57b6355f0ab17c42f57a09","relation":"prior_art"},{"repository":"vibemathing/problem-opg-46613-cubic-p3-partition","path":"research/verifiers.json","revision":"db657865c432d10c6f57b6355f0ab17c42f57a09","relation":"exact"},{"repository":"vibemathing/problem-opg-46613-cubic-p3-partition","path":".github/workflows/web-candidate-gate.yml","revision":"db657865c432d10c6f57b6355f0ab17c42f57a09","relation":"exact"}],"requested_verification":["kernel_check","axiom_escape_audit","statement_faithfulness"],"verdict":"candidate_only","created_at":"2026-09-07T05:56:18.935706+00:00"}
