{"schema_version":"1.1.0","channel":"chatgpt-web-github-issue-pr-writer","repository":"vibemathing/problem-opg-46613-cubic-p3-partition","repository_identity":{"binding_state":"verified","database_id":1358762601,"node_id":"R_kgDOUP0SaQ","default_branch":"main"},"problem_id":"problem:opg-46613-cubic-p3-partition","problem_contract_sha256":"f22ec1937d8b771614cb85435b6d4e0712afb9a3939780e04b74e4649617c26a","harness_snapshot_sha256":"9ff6002285f1cc3ee7bec0a201a09d048dc0fa95a3156120d20aeb9b4177858a","base_revision":"5ca9853dac41da3828b9b6f23c192bb59f0a1e8d","importer_policy_sha256":"a7650a8ba5be3fef370914b24a49b1118f57dc12f41980f21b11ef2b0a8267c1","attempt_id":"attempt:web-20260906-opg46613-a01","route_id":"route:two-factor-divisible-cycles-v1","graph_id":"graph:opg46613-initial-v1","obligation_id":"obligation:opg46613-divisible-two-factor","generator":{"principal":"chatgpt-web-github","model_label":"GPT-5.6 Sol","model_fingerprint_status":"unverified"},"transport":{"branch":"web/attempt-opg46613-a01-c08-independent-verifier","issue_number":3,"issue_url":"https://github.com/vibemathing/problem-opg-46613-cubic-p3-partition/issues/3","pull_request_number":18,"pull_request_url":"https://github.com/vibemathing/problem-opg-46613-cubic-p3-partition/pull/18"},"objective":"Independent verifier attack on C02's 18-vertex obstruction and 18+12q family, plus an explicitly uncompiled Lean formalization path; no root closure or admission.","candidate_artifacts":[{"candidate_id":"candidate:opg46613-c08-verifier-report","kind":"proof","locator":"research/artifacts/candidates/opg46613-c08-independent-verifier/verifier-report.md","sha256":"28ce70883826ce5c3d0cbac29249dc694c2839cee4f42f45ae84f389184b0739"},{"candidate_id":"candidate:opg46613-c08-independent-replay","kind":"computation","locator":"research/artifacts/candidates/opg46613-c08-independent-verifier/verify.py","sha256":"9234a212e2466def34455275d38f2d5ccc7cceb7c6e432d8b3c367afe379418b"},{"candidate_id":"candidate:opg46613-c08-lean-local","kind":"proof","locator":"research/artifacts/candidates/opg46613-c08-independent-verifier/lean/Local.lean","sha256":"e32edc8d553a3f924d3ee5a9cb9c77169528510c6a7e1499bcfaca9994ebbcfe"},{"candidate_id":"candidate:opg46613-c08-lean-semantics","kind":"proof","locator":"research/artifacts/candidates/opg46613-c08-independent-verifier/lean/MathlibTargets.lean","sha256":"b54003ebde007597e59a9d3b275a4bf59fbbf0e20818fcda9937a81b076de3d9"}],"atomic_claims":[{"claim_id":"claim:opg46613-c08-finite-replay","text":"A fresh standard-library implementation scans all 4,686,825 nine-edge subsets of the labeled 18-vertex C02 graph, finds exactly 26 perfect matchings and zero divisible complementary 2-factors, with spectra counts 6,4,16 as recorded.","status":"candidate"},{"claim_id":"claim:opg46613-c08-domain-factor","text":"The same independent implementation checks all 172 deletions of at most two vertices and the displayed noninduced P3-factor for the labeled 18-vertex graph.","status":"candidate"},{"claim_id":"claim:opg46613-c08-bipartite-necessity","text":"Dropping the bipartite right-brick hypothesis is unsound: the Petersen/Petersen three-sum control has a spanning (9,9) 2-factor. This attacks only that overgeneralization, not C02.","status":"candidate"},{"claim_id":"claim:opg46613-c08-family-audit","text":"A line-by-line audit of the general 18+12q construction found no contradiction; the bipartition degree-sum argument gives exactly two selected boundary edges and the explicit P3 partition has the required order arithmetic.","status":"candidate"},{"claim_id":"claim:opg46613-c08-lean-boundary","text":"Lean files specify arithmetic endpoints, exhaustive local five-cycle certificates and the intended Mathlib semantics, but were not compiled and do not prove FamilyTarget or RootProblem.","status":"candidate"}],"assumptions":["Finite simple graphs; cubic means every vertex has degree three and 3-connected means vertex connectivity at least three.","P3 is a selected two-edge path on three distinct vertices and need not be induced.","The C02 family uses a bipartite right brick; the independent negative control shows this hypothesis cannot simply be removed.","Allowed axioms remain finite-graph-basic and finite-combinatorics; no new axiom or verifier identity is admitted."],"risks":["The finite exhaustive replay concerns the single labeled 18-vertex witness, not a graph-order census or a proof of minimum obstruction order.","The all-q family audit is mathematical prose plus bounded parameter checks; the full family has no Lean kernel receipt.","The producing environment had no Lean executable; Local.lean and MathlibTargets.lean are uncompiled drafts and may require API or proof repairs.","Global restriction/embedding, closed-component transfer, all-q connectivity, explicit P3 bijection and matching-complement bridges remain open formalization obligations.","C02 separates the stronger divisible-two-factor assertion from the root; it neither proves nor refutes the root problem.","CI, content hashes and transport checks are not mathematical admission."],"open_obligations":["obligation:opg46613-divisible-two-factor","obligation:opg46613-root"],"failed_route_proposal":null,"source_refs":[{"repository":"vibemathing/problem-opg-46613-cubic-p3-partition","path":"problem-library/records/canonical-problems.jsonl","revision":"5ca9853dac41da3828b9b6f23c192bb59f0a1e8d","relation":"exact"},{"repository":"vibemathing/problem-opg-46613-cubic-p3-partition","path":"research/records/obligation-graphs.jsonl","revision":"5ca9853dac41da3828b9b6f23c192bb59f0a1e8d","relation":"exact"},{"repository":"vibemathing/problem-opg-46613-cubic-p3-partition","path":"research/artifacts/candidates/opg46613-c02/proof.md","revision":"5ca9853dac41da3828b9b6f23c192bb59f0a1e8d","relation":"prior_art"},{"repository":"vibemathing/problem-opg-46613-cubic-p3-partition","path":"research/artifacts/candidates/opg46613-c02/witness.json","revision":"5ca9853dac41da3828b9b6f23c192bb59f0a1e8d","relation":"exact"},{"repository":"vibemathing/problem-opg-46613-cubic-p3-partition","path":"research/artifacts/candidates/opg46613-c01/proof.md","revision":"5ca9853dac41da3828b9b6f23c192bb59f0a1e8d","relation":"prior_art"}],"requested_verification":["kernel_check","axiom_escape_audit","statement_faithfulness"],"verdict":"candidate_only","created_at":"2026-09-07T00:44:00Z"}
