{"schema_version":"1.1.0","channel":"chatgpt-web-github-issue-pr-writer","repository":"vibemathing/problem-opg-46613-cubic-p3-partition","repository_identity":{"binding_state":"verified","database_id":1358762601,"node_id":"R_kgDOUP0SaQ","default_branch":"main"},"problem_id":"problem:opg-46613-cubic-p3-partition","problem_contract_sha256":"f22ec1937d8b771614cb85435b6d4e0712afb9a3939780e04b74e4649617c26a","harness_snapshot_sha256":"9ff6002285f1cc3ee7bec0a201a09d048dc0fa95a3156120d20aeb9b4177858a","base_revision":"8eed5b0552ed3f257917d3a161ca5d6d9b358bed","importer_policy_sha256":"a7650a8ba5be3fef370914b24a49b1118f57dc12f41980f21b11ef2b0a8267c1","attempt_id":"attempt:web-20260906-opg46613-a01","route_id":"route:two-factor-divisible-cycles-v1","graph_id":"graph:opg46613-initial-v1","obligation_id":"obligation:opg46613-divisible-two-factor","generator":{"principal":"chatgpt-web-github","model_label":"GPT-6 Astra Pro","model_fingerprint_status":"unverified"},"transport":{"branch":"web/attempt-opg46613-transport-20260907-r01","issue_number":3,"issue_url":"https://github.com/vibemathing/problem-opg-46613-cubic-p3-partition/issues/3","pull_request_number":null,"pull_request_url":null},"objective":"Transport-only recovery of missing C08 detail outputs, new bounded replays of unchanged C06/C08 programs, sanitized PR18 review intake, and exact residual inventory; no new mathematical research.","candidate_artifacts":[{"candidate_id":"candidate:opg46613-transport-20260907-r01-1","kind":"computation","locator":"research/artifacts/candidates/opg46613-c08-independent-verifier/outputs/all_26_matchings.json","sha256":"5eb942b3ebe70b057f96e71670c5ff6a555e7bf22ee0073ab1a20c0b710796bf"},{"candidate_id":"candidate:opg46613-transport-20260907-r01-2","kind":"computation","locator":"research/artifacts/candidates/opg46613-c08-independent-verifier/outputs/fragment_states.json","sha256":"7563c95856993580ea9aba7c24443529023ae823b941a052c51759010be58f00"},{"candidate_id":"candidate:opg46613-transport-20260907-r01-3","kind":"computation","locator":"research/artifacts/candidates/opg46613-transport-20260907-r01/c06-replay-stdout.json","sha256":"de34747591c3f9ebe9da283aea14a48fdd8d9fabcf477844c611169c6f3fecf7"},{"candidate_id":"candidate:opg46613-transport-20260907-r01-4","kind":"computation","locator":"research/artifacts/candidates/opg46613-transport-20260907-r01/c08-replay-stdout.json","sha256":"c79225990c9e5a8cae0abcf9dfbcaa33f52da61b94bb6c3afb1eadca790fc2b2"},{"candidate_id":"candidate:opg46613-transport-20260907-r01-5","kind":"computation","locator":"research/artifacts/candidates/opg46613-transport-20260907-r01/execution-records.json","sha256":"64af184ac6062cc06e5d507a60306679b3aef1bd1d1b7f169d34c7a0b03b0500"},{"candidate_id":"candidate:opg46613-transport-20260907-r01-6","kind":"proof","locator":"research/artifacts/candidates/opg46613-transport-20260907-r01/review-intake.md","sha256":"94a3db677d985f21e23f136e2c70cb3e09f27e7cb8aa88642dff96a36d54a9ab"},{"candidate_id":"candidate:opg46613-transport-20260907-r01-7","kind":"computation","locator":"research/artifacts/candidates/opg46613-transport-20260907-r01/missing-originals.json","sha256":"c8a6ce89c330c7501bb93c21b72ff596030075ac02873fd992b909a8ec19a709"},{"candidate_id":"candidate:opg46613-transport-20260907-r01-8","kind":"computation","locator":"research/artifacts/candidates/opg46613-transport-20260907-r01/file-inventory.json","sha256":"751d67c52136d024eb11bae1cda74172ba73ea72526227d9258776e1a5797160"}],"atomic_claims":[{"claim_id":"claim:opg46613-transport-20260907-r01-replay","text":"The exact archived C08 script and input newly replayed with exit 0, producing 26 matching records and eight fragment states; the exact archived C06 script newly replayed with exit 0 and 12014 cases. No new graph-order census or historical receipt is claimed.","status":"candidate"},{"claim_id":"claim:opg46613-transport-20260907-r01-review","text":"The user-reported PR18 Lean failures and passes are archived as an attributed review, not new verifier receipts; missing historical originals remain explicit.","status":"candidate"}],"assumptions":["The archived source/input Git blob identities are fixed.","Finite replays retain the original noninduced P3 semantics and limited scope."],"risks":["Lean was not executed in this runtime; its repair is separate and pending.","Compact JSON detail files preserve all data but are not claimed to have original historical whitespace or digests.","Historical local-only files and the user isolated draft/logs are unavailable; transport is not declared complete.","Existing program labels do not grant a verifier trust domain.","CI and merge do not generate mathematical Evidence."],"open_obligations":["obligation:opg46613-divisible-two-factor","obligation:opg46613-root"],"failed_route_proposal":null,"source_refs":[{"repository":"vibemathing/problem-opg-46613-cubic-p3-partition","path":"problem-library/records/canonical-problems.jsonl","revision":"8eed5b0552ed3f257917d3a161ca5d6d9b358bed","relation":"exact"},{"repository":"vibemathing/problem-opg-46613-cubic-p3-partition","path":"research/records/obligation-graphs.jsonl","revision":"8eed5b0552ed3f257917d3a161ca5d6d9b358bed","relation":"exact"},{"repository":"vibemathing/problem-opg-46613-cubic-p3-partition","path":"research/artifacts/candidates/opg46613-c08-independent-verifier/verify.py","revision":"8eed5b0552ed3f257917d3a161ca5d6d9b358bed","relation":"exact"},{"repository":"vibemathing/problem-opg-46613-cubic-p3-partition","path":"research/artifacts/candidates/opg46613-c08-independent-verifier/inputs/C02-witness.json","revision":"8eed5b0552ed3f257917d3a161ca5d6d9b358bed","relation":"exact"},{"repository":"vibemathing/problem-opg-46613-cubic-p3-partition","path":"research/artifacts/candidates/opg46613-c06/triangle_audit.py","revision":"8eed5b0552ed3f257917d3a161ca5d6d9b358bed","relation":"exact"},{"repository":"vibemathing/problem-opg-46613-cubic-p3-partition","path":"research/artifacts/candidates/opg46613-root-r07/transport-reconciliation.json","revision":"8eed5b0552ed3f257917d3a161ca5d6d9b358bed","relation":"exact"}],"requested_verification":["kernel_check","axiom_escape_audit","statement_faithfulness"],"verdict":"candidate_only","created_at":"2026-09-07T01:42:26.389223Z"}
