{"schema_version":"1.1.0","channel":"chatgpt-web-github-issue-pr-writer","repository":"vibemathing/problem-opg-46613-cubic-p3-partition","repository_identity":{"binding_state":"verified","database_id":1358762601,"node_id":"R_kgDOUP0SaQ","default_branch":"main"},"problem_id":"problem:opg-46613-cubic-p3-partition","problem_contract_sha256":"f22ec1937d8b771614cb85435b6d4e0712afb9a3939780e04b74e4649617c26a","harness_snapshot_sha256":"9ff6002285f1cc3ee7bec0a201a09d048dc0fa95a3156120d20aeb9b4177858a","base_revision":"04735a4efa1e454a6765983ebedee82554783c1e","importer_policy_sha256":"a7650a8ba5be3fef370914b24a49b1118f57dc12f41980f21b11ef2b0a8267c1","attempt_id":"attempt:web-20260906-opg46613-a01","route_id":"route:two-factor-divisible-cycles-v1","graph_id":"graph:opg46613-initial-v1","obligation_id":"obligation:opg46613-divisible-two-factor","generator":{"principal":"chatgpt-web-github","model_label":"GPT-6 Astra Pro","model_fingerprint_status":"unverified"},"transport":{"branch":"web/attempt-opg46613-c08-review-repair-r01","issue_number":3,"issue_url":"https://github.com/vibemathing/problem-opg-46613-cubic-p3-partition/issues/3","pull_request_number":21,"pull_request_url":"https://github.com/vibemathing/problem-opg-46613-cubic-p3-partition/pull/21"},"objective":"Versioned source repair for the existing PR18 review: fromRel adjacency constructor, localized degree-faithfulness proof and finite heartbeat cap; compilation and performance are pending, no new mathematics.","candidate_artifacts":[{"candidate_id":"candidate:opg46613-c08-review-repair-r01-1","kind":"formalization","locator":"research/artifacts/candidates/opg46613-c08-review-repair-r01/lean/MathlibTargets.lean","sha256":"9b49f32cf9f40c55863f00545f08975c3ca8609f2c6437841927d03e51fd7881"},{"candidate_id":"candidate:opg46613-c08-review-repair-r01-2","kind":"formalization","locator":"research/artifacts/candidates/opg46613-c08-review-repair-r01/lean/Local.lean","sha256":"3bebbf614fed383be7d386f77a7622402c1526faf390a9a830fc243dfd2f156d"},{"candidate_id":"candidate:opg46613-c08-review-repair-r01-3","kind":"computation","locator":"research/artifacts/candidates/opg46613-c08-review-repair-r01/source-diff.patch","sha256":"27c4b52fe45106023ea69c9d21e2b4acff48bdaadb3bd3b4acfb25e2dbcdcb6b"},{"candidate_id":"candidate:opg46613-c08-review-repair-r01-4","kind":"computation","locator":"research/artifacts/candidates/opg46613-c08-review-repair-r01/repair-status.json","sha256":"0a581f0e151543ea636a233711658be3202cd9a70197ef05820fc70789a029ed"},{"candidate_id":"candidate:opg46613-c08-review-repair-r01-5","kind":"proof","locator":"research/artifacts/candidates/opg46613-c08-review-repair-r01/README.md","sha256":"e8d5f0e317ab9576c549b6d141c3de8879134dd194b399a551c560bb6d1737fe"},{"candidate_id":"candidate:opg46613-c08-review-repair-r01-6","kind":"computation","locator":"research/artifacts/candidates/opg46613-c08-review-repair-r01/file-inventory.json","sha256":"e48e1847c4a0b189d238aa5b3848d4a8f6929b25f8236209c896eb01a480ef9d"}],"atomic_claims":[{"claim_id":"claim:opg46613-c08-review-repair-r01-source","text":"The versioned draft preserves the original graph adjacency contract, public local degree statement and all following closed-five predicates and theorems; no compile or performance success is claimed.","status":"candidate"}],"assumptions":["Original C08 source hashes are fixed and unchanged.","The full intended Mathlib revision must be supplied and pinned before replay."],"risks":["No lean, lake or elan executable was found; all new Lean source is pending compilation.","The user reports only a Mathlib revision prefix; this is not an immutable dependency pin.","Symbolic simp proof attempts may need API repair; the remaining large decide proofs may still exceed budgets.","Lexical scans and CI do not establish kernel correctness, performance, semantic faithfulness or root closure.","Known missing historical originals remain listed in the prior recovery inventory."],"open_obligations":["obligation:opg46613-divisible-two-factor","obligation:opg46613-root"],"failed_route_proposal":null,"source_refs":[{"repository":"vibemathing/problem-opg-46613-cubic-p3-partition","path":"problem-library/records/canonical-problems.jsonl","revision":"04735a4efa1e454a6765983ebedee82554783c1e","relation":"exact"},{"repository":"vibemathing/problem-opg-46613-cubic-p3-partition","path":"research/records/obligation-graphs.jsonl","revision":"04735a4efa1e454a6765983ebedee82554783c1e","relation":"exact"},{"repository":"vibemathing/problem-opg-46613-cubic-p3-partition","path":"research/artifacts/candidates/opg46613-c08-independent-verifier/lean/Local.lean","revision":"04735a4efa1e454a6765983ebedee82554783c1e","relation":"prior_art"},{"repository":"vibemathing/problem-opg-46613-cubic-p3-partition","path":"research/artifacts/candidates/opg46613-c08-independent-verifier/lean/MathlibTargets.lean","revision":"04735a4efa1e454a6765983ebedee82554783c1e","relation":"prior_art"},{"repository":"vibemathing/problem-opg-46613-cubic-p3-partition","path":"research/artifacts/candidates/opg46613-transport-20260907-r01/review-intake.md","revision":"04735a4efa1e454a6765983ebedee82554783c1e","relation":"prior_art"},{"repository":"vibemathing/problem-opg-46613-cubic-p3-partition","path":"research/artifacts/candidates/opg46613-transport-20260907-r01/missing-originals.json","revision":"04735a4efa1e454a6765983ebedee82554783c1e","relation":"prior_art"}],"requested_verification":["kernel_check","axiom_escape_audit","statement_faithfulness"],"verdict":"candidate_only","created_at":"2026-09-07T01:55:49.069138Z"}
